{
  "format": "urrf.universal-art-asset-provider-execution.v0.1",
  "version": "0.1.0",
  "execution_id": "urrf-universal-art-asset-provider-execution:a195dbaedb9a01e88672feb7",
  "source": "urrf-provider-execution-evaluator",
  "asset_id": "asset:cf644862f780b86ae2bd9e94",
  "asset_profile": "character",
  "quality_tier": "AAA",
  "genome_root": "6af9eacaaaae30d65296d00f0acdc93d7eae27d843d25d80cea045eafd4fd297",
  "resolution_root": "316d253d671be86fa25327cfe9af334c0f808915dc742ffd60bd3773fbefc9b7",
  "provider_id": "provider:taowind:procedural-3d",
  "provider_root": "82bf355a8b42fab295e1e96258e645703292ec27b20f119276e9e161cbb4b006",
  "provider_source": "ragf-reference-provider",
  "request": {
    "format": "urrf.universal-art-asset-provider-execution-request.v0.1",
    "version": "0.1.0",
    "asset_id": "asset:cf644862f780b86ae2bd9e94",
    "asset_profile": "character",
    "quality_tier": "AAA",
    "seed": "urrf-universal-art-asset-forge-integration",
    "genome_root": "6af9eacaaaae30d65296d00f0acdc93d7eae27d843d25d80cea045eafd4fd297",
    "resolution_root": "316d253d671be86fa25327cfe9af334c0f808915dc742ffd60bd3773fbefc9b7",
    "provider_id": "provider:taowind:procedural-3d",
    "provider_root": "82bf355a8b42fab295e1e96258e645703292ec27b20f119276e9e161cbb4b006",
    "provider_source": "ragf-reference-provider",
    "payload": null,
    "request_root": "baa2f245db9524e871ef0eecb5e0151dd137bd347617100e89686bbdaf485cb1"
  },
  "execution": {
    "mode": "RAGF_REFERENCE_WORKSPACE",
    "status": "COMPLETED",
    "provider_id": "provider:taowind:procedural-3d",
    "provider_root": "82bf355a8b42fab295e1e96258e645703292ec27b20f119276e9e161cbb4b006",
    "provider_source": "ragf-reference-provider",
    "runtime_binding": "BUILTIN_REFERENCE",
    "attempted": true,
    "runtime_execution_performed": true,
    "provider_runtime_performed": false,
    "job_state": null,
    "failure_code": null
  },
  "output": {
    "workspace_root": "dc97f010a63fd9ec37bda78695087f82da52170315f7f1f5e04c2c3b5936785f",
    "workspace_verified": true,
    "job_root": null,
    "result_root": null,
    "failure_code": null,
    "failure_root": null,
    "candidate_root": "bb0b52afb44be19f484bccbcb1833e1da3a46e39cd2c66357334f9f91821eb16",
    "provider_court_root": null,
    "acceptance_root": "1d55cc7e0acf5c387fe53cd5fe41157dcc160aab9896a2eb163d518ebedeae93",
    "evidence_ledger_root": "29e03620a23134a3c0542872dec1190352cc4fb422b1f7ea9dd0c7c01770e8b3",
    "file_inspection_root": "70c831a94250e93f747a1d8320901dbc6253d1e9b014bf0eb11dcbeb0c11b253",
    "materialization_path": null,
    "materialization_root": null,
    "materialized_file_count": 0,
    "materialized_file_roots": [],
    "materialization_skipped": [],
    "output_root": "44848ca8aa734a91587de32cc1bd6a44d69d70e7ee8f617d73912f8f6fa8e6c9"
  },
  "replay": {
    "input_root": "baa2f245db9524e871ef0eecb5e0151dd137bd347617100e89686bbdaf485cb1",
    "output_root": "44848ca8aa734a91587de32cc1bd6a44d69d70e7ee8f617d73912f8f6fa8e6c9",
    "status": "NOT_RUN",
    "deterministic_claim": "NOT_PROVEN",
    "provider_runtime_replay_required": false,
    "replay_authority": "PROVIDER_RUNTIME_REQUIRED"
  },
  "checks": {
    "genome_binding": true,
    "resolution_binding": true,
    "provider_binding": true,
    "request_integrity": true,
    "job_integrity": true,
    "result_integrity": true,
    "failure_integrity": true,
    "materialization_integrity": true,
    "output_integrity": true,
    "candidate_binding": true,
    "acceptance_binding": true,
    "evidence_binding": true,
    "execution_truthfulness": true,
    "no_aaa_escalation": true,
    "authority_boundary": true
  },
  "status": "CANDIDATE_PROVIDER_EXECUTION_PASS",
  "execution_attempted": true,
  "execution_performed": true,
  "provider_runtime_performed": false,
  "aaa_ready": false,
  "release_ready": false,
  "candidate_only": true,
  "authoritative": false,
  "canonical_write_authorized": false,
  "authority": {
    "canonical_owner": "RNCS",
    "representation_owner": "URRF",
    "provider_can_write_authoritative_world_state": false,
    "provider_can_commit": false,
    "acceptance_can_commit": false,
    "rncs_authority_required": true
  },
  "execution_root": "936f58b1574821f321de896e82cb2856887b7b118089b2a1b444dbe346436f2d"
}
